{
  "symbol": "mu_0",
  "name_ar": "النفاذية المغناطيسية للفراغ",
  "name_en": "vacuum magnetic permeability",
  "value": "1.25663706127",
  "exponent": -6,
  "unit": "N A^-2",
  "dimensional_formula": "M L T^-2 I^-2",
  "definitional_status": "measured",
  "uncertainty_type": "standard",
  "standard_uncertainty": "0.00000000020",
  "relative_uncertainty": "1.6e-10",
  "coverage_factor_k": null,
  "codata_version": "CODATA 2022",
  "source_ref": {
    "source_id": "nist-codata-2022-wall",
    "url": "https://physics.nist.gov/cuu/pdf/wall_2022.pdf",
    "retrieved_at": "2026-08-31T00:00:00Z",
    "archive_hash_sha256": "0e9cabf28dbfd6a5e9695dec3a345c21997edc67584db670cf84f45c59d73855"
  },
  "verification_status": "VALIDATING",
  "history": [
    {
      "codata_version": "CODATA 2014",
      "value": "1.2566370614",
      "exponent": -6,
      "standard_uncertainty": null,
      "relative_uncertainty": null,
      "source_id": "nist-codata-2014-wall"
    },
    {
      "codata_version": "CODATA 2018",
      "value": "1.25663706212",
      "exponent": -6,
      "standard_uncertainty": "0.00000000019",
      "relative_uncertainty": "1.5e-10",
      "source_id": "nist-codata-2018-wall"
    },
    {
      "codata_version": "CODATA 2022",
      "value": "1.25663706127",
      "exponent": -6,
      "standard_uncertainty": "0.00000000020",
      "relative_uncertainty": "1.6e-10",
      "source_id": "nist-codata-2022-wall"
    }
  ]
}