{
  "symbol": "R",
  "name_ar": "ثابت الغازات المولي",
  "name_en": "molar gas constant",
  "value": "8.314462618",
  "exponent": 0,
  "unit": "J mol^-1 K^-1",
  "dimensional_formula": "M L^2 T^-2 Θ^-1 N^-1",
  "definitional_status": "defined_exact",
  "uncertainty_type": "exact",
  "standard_uncertainty": null,
  "relative_uncertainty": null,
  "coverage_factor_k": null,
  "codata_version": "CODATA 2022",
  "source_ref": {
    "source_id": "nist-codata-2022-wall",
    "url": "https://physics.nist.gov/cuu/pdf/wall_2022.pdf",
    "retrieved_at": "2026-08-31T00:00:00Z",
    "archive_hash_sha256": "0e9cabf28dbfd6a5e9695dec3a345c21997edc67584db670cf84f45c59d73855"
  },
  "verification_status": "VALIDATING",
  "history": [
    {
      "codata_version": "CODATA 2014",
      "value": "8.3144598",
      "exponent": 0,
      "standard_uncertainty": "0.0000048",
      "relative_uncertainty": "5.7e-7",
      "source_id": "nist-codata-2014-wall"
    },
    {
      "codata_version": "CODATA 2018",
      "value": "8.314462618",
      "exponent": 0,
      "standard_uncertainty": null,
      "relative_uncertainty": null,
      "source_id": "nist-codata-2018-wall"
    },
    {
      "codata_version": "CODATA 2022",
      "value": "8.314462618",
      "exponent": 0,
      "standard_uncertainty": null,
      "relative_uncertainty": null,
      "source_id": "nist-codata-2022-wall"
    }
  ]
}