{
  "symbol": "G",
  "name_ar": "ثابت الجذب العام (ثابت نيوتن للجذب)",
  "name_en": "Newtonian constant of gravitation",
  "value": "6.67430",
  "exponent": -11,
  "unit": "m^3 kg^-1 s^-2",
  "dimensional_formula": "L^3 M^-1 T^-2",
  "definitional_status": "measured",
  "uncertainty_type": "standard",
  "standard_uncertainty": "0.00015",
  "relative_uncertainty": "2.2e-5",
  "coverage_factor_k": null,
  "codata_version": "CODATA 2022",
  "source_ref": {
    "source_id": "nist-codata-2022-wall",
    "url": "https://physics.nist.gov/cuu/pdf/wall_2022.pdf",
    "retrieved_at": "2026-08-31T00:00:00Z",
    "archive_hash_sha256": "0e9cabf28dbfd6a5e9695dec3a345c21997edc67584db670cf84f45c59d73855"
  },
  "verification_status": "VALIDATING",
  "history": [
    {
      "codata_version": "CODATA 2014",
      "value": "6.67408",
      "exponent": -11,
      "standard_uncertainty": "0.00031",
      "relative_uncertainty": "4.7e-5",
      "source_id": "nist-codata-2014-wall"
    },
    {
      "codata_version": "CODATA 2018",
      "value": "6.67430",
      "exponent": -11,
      "standard_uncertainty": "0.00015",
      "relative_uncertainty": "2.2e-5",
      "source_id": "nist-codata-2018-wall"
    },
    {
      "codata_version": "CODATA 2022",
      "value": "6.67430",
      "exponent": -11,
      "standard_uncertainty": "0.00015",
      "relative_uncertainty": "2.2e-5",
      "source_id": "nist-codata-2022-wall"
    }
  ]
}