{
  "symbol": "m_p",
  "name_ar": "كتلة البروتون",
  "name_en": "proton mass",
  "value": "1.67262192595",
  "exponent": -27,
  "unit": "kg",
  "dimensional_formula": "M",
  "definitional_status": "measured",
  "uncertainty_type": "standard",
  "standard_uncertainty": "0.00000000052",
  "relative_uncertainty": "3.1e-10",
  "coverage_factor_k": null,
  "codata_version": "CODATA 2022",
  "source_ref": {
    "source_id": "nist-codata-2022-wall",
    "url": "https://physics.nist.gov/cuu/pdf/wall_2022.pdf",
    "retrieved_at": "2026-08-31T00:00:00Z",
    "archive_hash_sha256": "0e9cabf28dbfd6a5e9695dec3a345c21997edc67584db670cf84f45c59d73855"
  },
  "verification_status": "VALIDATING",
  "history": [
    {
      "codata_version": "CODATA 2014",
      "value": "1.672621898",
      "exponent": -27,
      "standard_uncertainty": "0.000000021",
      "relative_uncertainty": "1.3e-8",
      "source_id": "nist-codata-2014-wall"
    },
    {
      "codata_version": "CODATA 2018",
      "value": "1.67262192369",
      "exponent": -27,
      "standard_uncertainty": "0.00000000051",
      "relative_uncertainty": "3.0e-10",
      "source_id": "nist-codata-2018-wall"
    },
    {
      "codata_version": "CODATA 2022",
      "value": "1.67262192595",
      "exponent": -27,
      "standard_uncertainty": "0.00000000052",
      "relative_uncertainty": "3.1e-10",
      "source_id": "nist-codata-2022-wall"
    }
  ]
}