{
  "symbol": "R_inf",
  "name_ar": "ثابت ريدبرغ",
  "name_en": "Rydberg constant",
  "value": "10973731.568157",
  "exponent": 0,
  "unit": "m^-1",
  "dimensional_formula": "L^-1",
  "definitional_status": "measured",
  "uncertainty_type": "standard",
  "standard_uncertainty": "0.000012",
  "relative_uncertainty": "1.1e-12",
  "coverage_factor_k": null,
  "codata_version": "CODATA 2022",
  "source_ref": {
    "source_id": "nist-codata-2022-wall",
    "url": "https://physics.nist.gov/cuu/pdf/wall_2022.pdf",
    "retrieved_at": "2026-08-31T00:00:00Z",
    "archive_hash_sha256": "0e9cabf28dbfd6a5e9695dec3a345c21997edc67584db670cf84f45c59d73855"
  },
  "verification_status": "VALIDATING",
  "history": [
    {
      "codata_version": "CODATA 2014",
      "value": "10973731.568508",
      "exponent": 0,
      "standard_uncertainty": "0.000065",
      "relative_uncertainty": "5.9e-12",
      "source_id": "nist-codata-2014-wall"
    },
    {
      "codata_version": "CODATA 2018",
      "value": "10973731.568160",
      "exponent": 0,
      "standard_uncertainty": "0.000021",
      "relative_uncertainty": "1.9e-12",
      "source_id": "nist-codata-2018-wall"
    },
    {
      "codata_version": "CODATA 2022",
      "value": "10973731.568157",
      "exponent": 0,
      "standard_uncertainty": "0.000012",
      "relative_uncertainty": "1.1e-12",
      "source_id": "nist-codata-2022-wall"
    }
  ]
}