{
  "symbol": "epsilon_0",
  "name_ar": "السماحية الكهربائية للفراغ",
  "name_en": "vacuum electric permittivity",
  "value": "8.8541878188",
  "exponent": -12,
  "unit": "F m^-1",
  "dimensional_formula": "M^-1 L^-3 T^4 I^2",
  "definitional_status": "measured",
  "uncertainty_type": "standard",
  "standard_uncertainty": "0.0000000014",
  "relative_uncertainty": "1.6e-10",
  "coverage_factor_k": null,
  "codata_version": "CODATA 2022",
  "source_ref": {
    "source_id": "nist-codata-2022-wall",
    "url": "https://physics.nist.gov/cuu/pdf/wall_2022.pdf",
    "retrieved_at": "2026-08-31T00:00:00Z",
    "archive_hash_sha256": "0e9cabf28dbfd6a5e9695dec3a345c21997edc67584db670cf84f45c59d73855"
  },
  "verification_status": "VALIDATING",
  "history": [
    {
      "codata_version": "CODATA 2014",
      "value": "8.854187817",
      "exponent": -12,
      "standard_uncertainty": null,
      "relative_uncertainty": null,
      "source_id": "nist-codata-2014-wall"
    },
    {
      "codata_version": "CODATA 2018",
      "value": "8.8541878128",
      "exponent": -12,
      "standard_uncertainty": "0.0000000013",
      "relative_uncertainty": "1.5e-10",
      "source_id": "nist-codata-2018-wall"
    },
    {
      "codata_version": "CODATA 2022",
      "value": "8.8541878188",
      "exponent": -12,
      "standard_uncertainty": "0.0000000014",
      "relative_uncertainty": "1.6e-10",
      "source_id": "nist-codata-2022-wall"
    }
  ]
}